<?xml version="1.0" encoding="UTF-8"?>
<?xml-stylesheet type="text/css" href="QLLH2.css"?>
<QLLH xmlns:xsi="http://www.w3.org/2001/XMLSchema-instance"
 xsi:noNamespaceSchemaLocation="file:/D:/XML/TruongQuocHuy_61133757/QLLH.xsd">
    <HocVien>
        <MaHV>AA00000</MaHV>
        <HoHV>HoHV0</HoHV>
        <TenHV>TenHV0</TenHV>
        <NgaySinh>2006-05-04</NgaySinh>
        <DiaChi>DiaChi0</DiaChi>
    </HocVien>
    <HocVien>
        <MaHV>AA00001</MaHV>
        <HoHV>HoHV1</HoHV>
        <TenHV>TenHV1</TenHV>
        <NgaySinh>2006-05-04</NgaySinh>
        <DiaChi>DiaChi1</DiaChi>
    </HocVien>
    <KhoaHoc>
        <MaKH>00</MaKH>
        <TenKH>TenKH0</TenKH>
        <NgayBD>2006-05-04</NgayBD>
    </KhoaHoc>
    <KhoaHoc>
        <MaKH>01</MaKH>
        <TenKH>TenKH1</TenKH>
        <NgayBD>2006-05-04</NgayBD>
    </KhoaHoc>
    <GiaoVien>
        <MaGV>AA000</MaGV>
        <HoTenGV>HoTenGV0</HoTenGV>
        <DiaChiGV>DiaChiGV0</DiaChiGV>
    </GiaoVien>
    <GiaoVien>
        <MaGV>AA001</MaGV>
        <HoTenGV>HoTenGV1</HoTenGV>
        <DiaChiGV>DiaChiGV1</DiaChiGV>
    </GiaoVien>
    <LopHoc>
        <MaLH>MaLH0</MaLH>
        <MaKH>00</MaKH>
        <MaGV>AA000</MaGV>
        <HocPhi>0</HocPhi>
    </LopHoc>
    <LopHoc>
        <MaLH>MaLH1</MaLH>
        <MaKH>00</MaKH>
        <MaGV>AA000</MaGV>
        <HocPhi>0</HocPhi>
    </LopHoc>
    <BienLai>
        <SoBL>A000</SoBL>
        <MaLH>MaLH1</MaLH>
        <MaHV>AA00000</MaHV>
        <NgayNop>2006-05-04</NgayNop>
    </BienLai>
    <BienLai>
        <SoBL>A001</SoBL>
        <MaLH>MaLH0</MaLH>
        <MaHV>AA00000</MaHV>
        <NgayNop>2006-05-04</NgayNop>
    </BienLai>
</QLLH>
